{
  "schema_version": "globalgrid2050.solar-dc.programme-state.v1",
  "current_build": "Build 025.5D1",
  "programme_stage": "Programme truth established; generic equipment contract active",
  "validated_commit": "36f1ab756d7ae5e9f9dbeb2256bec2e65d1f4ee5",
  "validated_commit_scope": "Programme-state, capsule-link, bounded-observation and engineering-package implementation through this commit was validated by pull-request merge testing. The subsequent checkpoint commit records that evidence and does not change electrical calculation authority.",
  "package_version": "0.4.0",
  "validation": {
    "workflow": "V10 Engine Validation",
    "run_id": 30676961307,
    "artifact_id": 8810817726,
    "merge_test_sha": "acb1d65583dbca1e57737d7701a30f8b0b276669",
    "comparison_hash": "sha256:413aa93c98d1b9fd5f9ffee4f577cfe29a6e74f48bd927a3ebe7f541545d6366",
    "suites": [
      {
        "name": "Python",
        "passed": 282,
        "total": 282
      },
      {
        "name": "V8 model",
        "passed": 13,
        "total": 13
      },
      {
        "name": "V8 authority reconciliation",
        "passed": 6,
        "total": 6
      },
      {
        "name": "V9 deterministic engine",
        "passed": 10,
        "total": 10
      },
      {
        "name": "V10 JavaScript",
        "passed": 13,
        "total": 13
      },
      {
        "name": "Clean installed wheel",
        "passed": 1,
        "total": 1
      }
    ]
  },
  "restore_point": "restore/2026-08-01-0151-pre-bounded-observation-law",
  "current_quantum_spawn": "docs/quantum-spawn/202608010151-bounded-observation-and-truncation-law.md",
  "current_trueself": "docs/trueself/202608010154-ts-002-programme-truth-and-capsule-integrity.md",
  "reference_inverter_block": {
    "module_technology": "bifacial",
    "module_rated_power_wp": 660,
    "modules_per_string": 30,
    "string_rated_power_kwp": 19.8,
    "strings": 24,
    "module_count": 720,
    "dc_nameplate_power_kwp": 475.2,
    "inverter_apparent_power_kva": 352,
    "dc_ac_nameplate_ratio": 1.35
  },
  "capabilities": {
    "canonical": [
      "deterministic module placement for the 24 by 30 reference fixture",
      "ordered string topology and physical input assignment",
      "explicit sequential and leapfrog routing",
      "geometry, topology, assignment, routing and calculation receipts",
      "complete-circuit resistance, voltage drop, loss and uncertainty",
      "installed solar_topology package and clean-wheel authority",
      "machine-readable programme truth and capsule-link integrity gates"
    ],
    "provisional": [
      "resistance source qualification and assessment serialisation",
      "generic 4 mm2 and 6 mm2 metal-coated class 5 resistance sources",
      "browser workbenches as exploratory projections"
    ],
    "historical": [
      "V6 complete-circuit browser workbench",
      "V7 electromagnetic FEED workbench",
      "V8 leapfrog cable-schedule workbench",
      "V9 deterministic sandbox",
      "V10 browser development workbench"
    ]
  },
  "active_gate": "TS-003 — Freeze the generic reference equipment contract",
  "next_single_goal": "TS-004 — Add the complete inverter-block aggregate and receipt",
  "known_limitations": [
    "The generic conductor resistance records remain candidates because exact source revisions are not encoded and verification is incomplete.",
    "The complete 352 kVA inverter-block aggregate and portable project contract are not yet first-class kernel objects.",
    "Physical inverter inputs, MPPT control relationships and any shared DC-bus or reverse-current-blocking behaviour still require evidence-bound completion.",
    "The production browser is not yet a calculation-free thin client.",
    "Standards, EMC, lightning, environmental classes, plant ingestion and fleet intelligence remain later controlled builds."
  ],
  "progress_policy": "No numerical programme-completion percentage is claimed until explicit stage weights and acceptance evidence are encoded in this manifest.",
  "generated_outputs": [
    "README.md programme-state block",
    "progress-dashboard.html"
  ]
}
